Quantity,Brand,Part Number,Subcategory,Application,Engine,Description,Jobber,Public Price,Last Purchase,Last Sale,Category,Dealer,Type
1,ACL,OPHD1194HP,Engine,Honda B-Series,1.6L/1.8L/2.0L,ACL Honda B20B4/B18C1/B16A2/B20Z2 High Performance Oil Pump,"$3,420.00 ","$3,830.00 ",4-Jun-23,4-Jun-23,D,$0.00 ,E
,AAM Competition,AAMC37T-IC-STGII,Cooling,Nissan 370Z V6 3.7L +09,3.7L,AAM Competition 370Z STG II Intercooler,$140.00 ,$150.00 ,31-Dec-69,31-Dec-69,-,$0.00 ,E
,AAM Competition,AAMC37T-TTK-T-STGII,Turbo/SC,Nissan 370Z +12,3.7L,"AAM Competition 370Z (2012+) Twin Turbo Kit - Tuner Series With Stage 2
Upgrade Turbos (370Z STG I Intercooler)",$140.00 ,$150.00 ,31-Dec-69,31-Dec-69,-,$0.00 ,E
,ACL,4B8172H-STD,Engine,Ford Focus 2.3 Ecoboost,2.3T,ACL L3-VDT MZR Duratec 2260cc Turbo Standard Size High Performance Rod Bearing Set,$140.00 ,$150.00 ,31-Dec-69,31-Dec-69,-,$0.00 ,E
,ACL,4B8310H-STD,Engine,Subaru WRX DIT +15,2.0T,ACL Subaru/Scion FA20 Standard Size High Performance Rod Bearing Set,$140.00 ,$150.00 ,31-Dec-69,31-Dec-69,-,$0.00 ,E
,ACL,5M8174HX-STD,Engine,Ford Focus 2.3 Ecoboost,2.3T,ACL 03+ Ford/Mazda 4 2.0L/2.3L DOHC Duratec Standard Size Race Series Main Bearing Set,$140.00 ,$150.00 ,31-Dec-69,31-Dec-69,-,$0.00 ,E
,ACL,6B2390H-.50,Engine,Nissan 300ZX V6 3.0TT 90-96,3.0TT,ACL Nissan VG30DETT 3.0L-V6 0.50mm Oversized High Performance Rod Bearing Set,$140.00 ,$150.00 ,31-Dec-69,31-Dec-69,-,$0.00 ,E
,ACL,8B1442HX,Engine,Ford Mustang V8 5.0 +10,5.0L,ACL Ford Prod V8 4.6L/5.4L Standard Size Race Series Connecting Rod Bearing Set,$140.00 ,$150.00 ,31-Dec-69,31-Dec-69,-,$0.00 ,E
,Advan,YAS9I25WA,Wheel,19x9 5x120 +25,All,Advan RS-DF Progressive 19x9.0 +25 5-120 Dark Bronze Metallic Wheel,$140.00 ,$150.00 ,31-Dec-69,31-Dec-69,-,$0.00 ,E
,AEM,21-781DS,Air Filter,Mercedes Benz CLA 250 13-19,2.0T,AEM 13-15 Mercedes CLA250 L4 2.5L Silver Cold Air Intake,$140.00 ,$150.00 ,31-Dec-69,31-Dec-69,-,$0.00 ,E
,AEM,21-786C,Air Filter,Mazda MX-5 +16,2.0L,AEM 2016 C.A.S Mazda MX-5 Miata L4-2.0L F/I Cold Air Intake,$140.00 ,$150.00 ,31-Dec-69,31-Dec-69,-,$0.00 ,E
,AEM,21-839C,Air Filter,Mini Cooper F56 14-18,2.0T,AEM 14-17 Mini Cooper S L4-2.0L F/I Gunmetal Gray Cold Air Intake,$140.00 ,$150.00 ,31-Dec-69,31-Dec-69,-,$0.00 ,E
,AEM,24-6030C,Air Filter,Mitsubishi Eclipse 2.0L M/T Only Silver V2 Intake,2.0L,AEM 95-99 Mitsubishi Eclipse 2.0L M/T Only Silver V2 Intake,$140.00 ,$150.00 ,31-Dec-69,31-Dec-69,-,$0.00 ,E
,AEM,25-302BK,Fuel,Universal,All,AEM Universal Black Adjustable Fuel Pressure Regulator,$140.00 ,$150.00 ,31-Dec-69,31-Dec-69,-,$0.00 ,E
,AEM,29-0005,Suspension,Mini Cooper R56 1.6T 2008-2013,1.6T,AEM 07-10 Mini Cooper S L4 Strut Bar,$140.00 ,$150.00 ,31-Dec-69,31-Dec-69,-,$0.00 ,E
,AEM,30-3304,Methanol,Universal,All,AEM V2 Standard Controller Kit - Internal MAP w/ 35psi Max,$140.00 ,$150.00 ,31-Dec-69,31-Dec-69,-,$0.00 ,E
,AEM,30-7106,Electronics,Universal up to 6 cylinder,All,AEM Infinity-6,$140.00 ,$150.00 ,31-Dec-69,31-Dec-69,-,$0.00 ,E
,aFe Power,30-10155,Air Filter,Filters OER P5R A/F P5R Jeep Wrangler JK 07-12 V6-3.8/3.6L,3.6L,aFe MagnumFLOW Filters OER P5R A/F P5R Jeep Wrangler JK 07-12 V6-3.8/3.6L,$140.00 ,$150.00 ,31-Dec-69,31-Dec-69,-,$0.00 ,E
,aFe Power,30-10195,Air Filter,Mercedes Benz V8 6.3 07-11,6.3L,aFe MagnumFLOW Filters OER P5R A/F P5R Mercedes AMG63 07-11 V8-6.3L (1 pr),$140.00 ,$150.00 ,31-Dec-69,31-Dec-69,-,$0.00 ,E
,aFe Power,30-10223,Air Filter,Mercedes Benz ML63 V8 4.4TT 2012+,5.5TT,aFe MagnumFLOW Filters OER P5R A/F P5R 11-14 Mercedes-Benz AMG CL63/E63/S63 V8-5.5L(t) (Qty 2),$140.00 ,$150.00 ,31-Dec-69,31-Dec-69,-,$0.00 ,E
,aFe Power,31-10303,Air Filter,Porsche Boxster/Cayman 718 17-20,2.5T,aFe Magnum FLOW OE Replacement Filter w/PDS Media 17-20 Porsche Boxster/Cayman (718) H4-2.0/2.5L (t),$140.00 ,$150.00 ,31-Dec-69,31-Dec-69,-,$0.00 ,E
,aFe Power,46-20415-B,Turbo/SC,Audi / Volkswagen / Seat 2.0T,2.0T,aFe 15-20 VW GTI Charge Pipe Kit,$140.00 ,$150.00 ,31-Dec-69,31-Dec-69,-,$0.00 ,E
,aFe Power,46-60222,Turbo/SC,Mini Cooper (N18 Engine),1.6T,aFe Bladerunner GT Series Turbocharger 11-15 Mini Cooper I4-1.6L (t),$140.00 ,$150.00 ,31-Dec-69,31-Dec-69,-,$0.00 ,E
,aFe Power,46-7111BB,Drivetrain,Jeep Wrangler Dana 30/44,3.6L,aFe Power Pro Series Dana 44 Front & Rear Diff Cover Black w/ Mach Fins 97-18 Jeep Wrangler (TJ/JK),$140.00 ,$150.00 ,31-Dec-69,31-Dec-69,-,$0.00 ,E
,aFe Power,48-32015-YN,Exhaust,Dodge Hellcat +17,6.2SC,aFe Twisted Steel 3in Connection-Pipe 15-19 Dodge Challenger/Charger Hellcat SRT-8 V8-6.4L,$140.00 ,$150.00 ,31-Dec-69,31-Dec-69,-,$0.00 ,E
,aFe Power,48-36211-YC,Exhaust,Jeep Grand Cherokee SRT/SRT-8 6.4L V8 +12,6.4L,aFe Twisted Steel Headers w/ Cats 12-14 Jeep Grand Cherokee SRT/SRT-8 6.4L V8,$140.00 ,$150.00 ,31-Dec-69,31-Dec-69,-,$0.00 ,E
,aFe Power,48-43020-HN,Turbo/SC,Ford F-150 V6 3.5 Ecoboost,3.5T,aFe Twisted Steel Down-Pipe Race Series 2017 Ford F-150 Raptor V6-3.5L (tt),$140.00 ,$150.00 ,31-Dec-69,31-Dec-69,-,$0.00 ,E
,aFe Power,50-40045R,Air Filter,BMW X5M/X6M F85 F86 V8 4.4 Bi-Turbo 2015-2019,4.4TT,aFe Momentum ST Pro 5R Intake System 15-19 BMW X5M / X6M 4.4L TT (S63),$140.00 ,$150.00 ,31-Dec-69,31-Dec-69,-,$0.00 ,E
,aFe Power,50-72205R,Air Filter,Dodge Hellcat +17,6.2SC,aFe Momentum GT 17-18 Dodge Charger/Challenger SRT Hellcat CAI(w/ Pro 5R Media Filter),$140.00 ,$150.00 ,31-Dec-69,31-Dec-69,-,$0.00 ,E
,aFe Power,51-12212,Air Filter,BMW 2/3/4-Series 12-18 L4-2.0L (t) N20,N20 2.0T,aFe MagnumFORCE Intakes Stage-2 Pro DRY S 12-15 BMW 328i (F30) L4 3.0L (t) N20,$140.00 ,$150.00 ,31-Dec-69,31-Dec-69,-,$0.00 ,E
,aFe Power,51-12492,Air Filter,Volkswagen New Beetle 2.5L,2.5L,aFe MagnumFORCE Intake Stage-2 Pro DRY S VW 09-14 Jetta/Golf 12-14 Passat/Beetle 2.5L,$140.00 ,$150.00 ,31-Dec-69,31-Dec-69,-,$0.00 ,E
,aFe Power,51-76303,Air Filter,BMW 528i F10 15-15 2.0T,2.0T,aFe Momentum Pro DRY S Intake System BMW 528i/ix (F10) 12-15 L4-2.0L (t) N20,$140.00 ,$150.00 ,31-Dec-69,31-Dec-69,-,$0.00 ,E
,aFe Power,52-10008R,Air Filter,Jeep Wrangler JL +18,3.6L,aFe Rapid Induction Pro 5R Cold Air Intake System 18-21 Jeep Wrangler(JL)/Gladiator(JT) 3.6L,$140.00 ,$150.00 ,31-Dec-69,31-Dec-69,-,$0.00 ,E
,aFe Power,54-10082,Air Filter,Ford F-150 97-05 V8-4.6/5.4L,4.6L,aFe MagnumFORCE Intakes Stage-2 P5R AIS P5R Ford F-150 97-05 V8-4.6/5.4L,$140.00 ,$150.00 ,31-Dec-69,31-Dec-69,-,$0.00 ,E
,aFe Power,54-10092,Air Filter,Chevrolet Sileverado V8 5.3 98-07,5.3L,aFe MagnumFORCE Intakes Stage-2 P5R AIS P5R GM Trucks/SUVs 99-07 V8-4.8/5.3L (GMT800),$140.00 ,$150.00 ,31-Dec-69,31-Dec-69,-,$0.00 ,E
,aFe Power,54-10451,Air Filter,P5R AIS P5R BMW 330i (E46) 01-06 L6-3.0L,3.0L,aFe MagnumFORCE Intakes Stage-1 P5R AIS P5R BMW 330i (E46) 01-06 L6-3.0L,$140.00 ,$150.00 ,31-Dec-69,31-Dec-69,-,$0.00 ,E
,aFe Power,54-10831,Air Filter,Volkswagen Golf/Jetta L4 1.8/1.9 00-04,1.8L,aFe MagnumFORCE Intakes Stage-1 P5R AIS P5R VW Golf/Jetta 00-04.5 l4-1.8/1.9L,$140.00 ,$150.00 ,31-Dec-69,31-Dec-69,-,$0.00 ,E
,aFe Power,54-11042,Air Filter,BMW 5-Series (E60) 06-09 L6-3.0L,3.0L,aFe MagnumFORCE Intakes Stage-2 P5R AIS P5R BMW 5-Series (E60) 06-09 L6-3.0L,$140.00 ,$150.00 ,31-Dec-69,31-Dec-69,-,$0.00 ,E
,aFe Power,54-11112,Air Filter,Volkswagen Jetta/GTI 05-08 L4-2.0L,1.8T,aFe MagnumFORCE Intakes Stage-2 P5R AIS P5R VW Jetta/GTI 05-08 L4-2.0L (t) MKV,$140.00 ,$150.00 ,31-Dec-69,31-Dec-69,-,$0.00 ,E
,aFe Power,54-11762,Air Filter,Chevrolet Camaro SS 10-15,6.2L,aFe MagnumFORCE Intakes Stage-2 P5R AIS P5R Chevrolet Camaro 10-11 V8-6.2L,$140.00 ,$150.00 ,31-Dec-69,31-Dec-69,-,$0.00 ,E
,aFe Power,54-11892,Air Filter,Audi / Volkswagen Beetle 2.0T,2.0T,aFe MagnumFORCE Intakes Stage-2 P5R AIS P5R VW GTI 09-11 L4-2.0L (t),$140.00 ,$150.00 ,31-Dec-69,31-Dec-69,-,$0.00 ,E
,aFe Power,54-11982-B,Air Filter,Ford Mustang GT V8 5.0 10-14,5.0L,aFe MagnumFORCE Intakes Stage-2 P5R AIS P5R Ford Mustang 11-12 V8-5.0L Black,$140.00 ,$150.00 ,31-Dec-69,31-Dec-69,-,$0.00 ,E
,aFe Power,54-12022,Air Filter,Chevrolet Camaro V6 3.6 12-15,3.6L,aFe MagnumFORCE Air Intake Stage-2 PRO 5R 12-14 Chevrolet Camaro V6 3.6L,$140.00 ,$150.00 ,31-Dec-69,31-Dec-69,-,$0.00 ,E
,aFe Power,54-12102-P,Air Filter,Ford Mustang V6 3.7 10-14,3.7L,aFe MagnumFORCE Intakes Stage-2 P5R AIS PDS Ford Mustang 11-12 V6-3.7L (pol),$140.00 ,$150.00 ,31-Dec-69,31-Dec-69,-,$0.00 ,E
,aFe Power,54-12172,Air Filter,Dodge Challenger V8 6.4L 11-21,6.4L,aFe MagnumFORCE Intake Stage-2 Pro 5R 11-12 Dodge Challenger/Charger / 11-12 Chrysler 300 V8 6.4L,$140.00 ,$150.00 ,31-Dec-69,31-Dec-69,-,$0.00 ,E
,aFe Power,54-12202,Air Filter,BMW M135i/M235i/335i/435i/M2 F87 12-16,N55 3.0T,aFe MagnumFORCE Intake Stage-2 Pro 5R 12-15 BMW 335i (F30) L6 3.0L (t) N55,$140.00 ,$150.00 ,31-Dec-69,31-Dec-69,-,$0.00 ,E
,aFe Power,54-12212,Air Filter,BMW 2/3/4-Series 12-18 L4-2.0L (t) N20,N20 2.0T,aFe MagnumFORCE Intakes Stage-2 PRO 5R 12-15 BMW 328i (F30) L4 3.0L (t) N20,$140.00 ,$150.00 ,31-Dec-69,31-Dec-69,-,$0.00 ,E
,aFe Power,54-12382,Air Filter,Chevrolet Camaro V6 3.6L 10-11,3.6L,aFe MagnumFORCE Air Intake Stage-2 Pro 5R 10-11 Chevrolet Camaro V6 3.6L,$140.00 ,$150.00 ,31-Dec-69,31-Dec-69,-,$0.00 ,E
,aFe Power,54-12492,Air Filter,Volkswagen New Beetle +12 2.5L,2.5L,aFe MagnumFORCE Intake Stage-2 PRO 5R VW 09-14 Jetta/Golf 12-14 Passat/Beetle 2.5L,$140.00 ,$150.00 ,31-Dec-69,31-Dec-69,-,$0.00 ,E
,aFe Power,54-12822,Air Filter,Ford Mustang Ecoboost 2.3T +15,2.3T,aFe MagnumFORCE Stage-2 Pro 5R Cold Air Intake System 15-17 Ford Mustang EcoBoost 2.3L (t),$140.00 ,$150.00 ,31-Dec-69,31-Dec-69,-,$0.00 ,E
,aFe Power,54-12912-C,Air Filter,BMW M240i B58,3.0T,aFe Magnum FORCE Stage-2 Pro 5R Cold Air Intake System 16-17 BMW 340i (F30) L6-3.0L (t) B58,$140.00 ,$150.00 ,31-Dec-69,31-Dec-69,-,$0.00 ,E
,aFe Power,54-13015R,Air Filter,Ford Mustang GT V8 5.0 15-17,5.0L,aFe Magnum FORCE Stage-2 Pro 5R Cold Air Intake System 15-17 Ford Mustang GT V8-5.0L,$140.00 ,$150.00 ,31-Dec-69,31-Dec-69,-,$0.00 ,E
,aFe Power,54-13023R,Air Filter,Jeep Grand Cherokee (WK2) V8-5.7L 11-21,5.7L,aFe Magnum FORCE Pro 5R Cold Air Intake System 11-19 Jeep Grand Cherokee (WK2) V8-5.7L,$140.00 ,$150.00 ,31-Dec-69,31-Dec-69,-,$0.00 ,E
,aFe Power,54-13032R,Air Filter,POWER Magnum FORCE Stage-2 Pro 5R Cold Air Intake,3.0L,aFe POWER Magnum FORCE Stage-2 Pro 5R Cold Air Intake System 15-19 BMW M3/M4 3.0L,$140.00 ,$150.00 ,31-Dec-69,31-Dec-69,-,$0.00 ,E
,aFe Power,54-13035R,Air Filter,Jeep Grand Cherokee V6 3.6L 16-22,3.6L,aFe Magnum FORCE Stage-2 PRO 5R CIA System 16-19 Jeep Grand Cherokee (WK2) - V6-3.6L,$140.00 ,$150.00 ,31-Dec-69,31-Dec-69,-,$0.00 ,E
,aFe Power,54-13053R,Air Filter,BMW 325i 3 Series E9x L6 3.0L 06-11,3.0L,aFe POWER Magnum FORCE Stage-2 Pro 5R Cold Air Intake System 06-13 BMW 3 Series L6-3.0L Non Turbo,$140.00 ,$150.00 ,31-Dec-69,31-Dec-69,-,$0.00 ,E
,aFe Power,54-20442,Air Filter,P5R AIS P5R BMW 3-Series (E46) 99-06 L6-2.5L/2.8L/3.0L,3.0L,aFe MagnumFORCE Intakes Stage-2 P5R AIS P5R BMW 3-Series (E46) 99-06 L6-2.5L/2.8L/3.0L,$140.00 ,$150.00 ,31-Dec-69,31-Dec-69,-,$0.00 ,E
,aFe Power,54-73114,Air Filter,Ford F-150 V8 5.0 15-20,5.0L,aFe Momentum GT Pro 5R Stage-2 Intake System 15-17 Ford F-150 V8 5.0L,$140.00 ,$150.00 ,31-Dec-69,31-Dec-69,-,$0.00 ,E
,aFe Power,54-73120-B,Air Filter,Ford F-150 Raptor V6 3.5L 17-20,3.5TT,aFe Momentum XP Pro 5R Cold Air Intake System 17-18 Ford F-150 Raptor V6-3.5L (tt) EcoBoost,$140.00 ,$150.00 ,31-Dec-69,31-Dec-69,-,$0.00 ,E
,aFe Power,54-73202,Air Filter,Ford Mustang V6 3.7L 2015-2017,3.7L,aFe Momentum GT AIS Pro 5R Intake System 15-17 Ford Mustang V6-3.7L,$140.00 ,$150.00 ,31-Dec-69,31-Dec-69,-,$0.00 ,E
,aFe Power,54-74210,Air Filter,Momentum GT Pro 5R Stage-2 Intake System 2016 Chevrolet Camaro SS V8-6.2L,6.2L,aFe Momentum GT Pro 5R Stage-2 Intake System 2016 Chevrolet Camaro SS V8-6.2L,$140.00 ,$150.00 ,31-Dec-69,31-Dec-69,-,$0.00 ,E
,aFe Power,54-76207,Air Filter,Jeep Grand Cherokee 3.6L V6 11-14,3.6L,aFe Momentum GT Stage 2 PRO 5R Intake 11-14 Jeep Grand Cherokee 3.6L V6,$140.00 ,$150.00 ,31-Dec-69,31-Dec-69,-,$0.00 ,E
,aFe Power,54-76303,Air Filter,BMW 528i F10 15-15 2.0T,2.0T,aFe Momentum Pro 5R Intake System BMW 528i/ix (F10) 12-15 L4-2.0L (t) N20,$140.00 ,$150.00 ,31-Dec-69,31-Dec-69,-,$0.00 ,E
,aFe Power,54-76306,Air Filter,BMW 135/335i 06-13 N54,3.0TT,aFe Momentum Pro 5R Intake System 07-10 BMW 335i/is/xi (E90/E92/E93),$140.00 ,$150.00 ,31-Dec-69,31-Dec-69,-,$0.00 ,E
,aFe Power,54-76314,Air Filter,BMW 118i 1.6T N13 11-15,1.6T,aFe Momentum GT Pro 5R Cold Air Intake System 11-15 BMW 116i/118i (F20/21) L4-1.6L (t) N13,$140.00 ,$150.00 ,31-Dec-69,31-Dec-69,-,$0.00 ,E
,aFe Power,54-81012-C,Air Filter,BMW 3 Series E9x L6 3.0L 06-11,3.0L,aFe MagnumForce Stage 2 Si Intake System P5R 06-11 BMW 3 Series E9x L6 3.0L Non-Turbo,$140.00 ,$150.00 ,31-Dec-69,31-Dec-69,-,$0.00 ,E
,aFe Power,54-82082-1,Air Filter,BMW X3 35ix L6 3.0 11-16,N55 3.0T,aFe MagnumFORCE Intakes Stage-2 P5R Si 11-16 BMW X3 35ix L6-3.0L,$140.00 ,$150.00 ,31-Dec-69,31-Dec-69,-,$0.00 ,E
,aFe Power,54-82202,Air Filter,BMW M135i/M235i/335i/435i/M2 F87 12-16,N55 3.0T,aFe Momentum Intake Stage-2 Si Pro 5R 14 BMW 435i (F32) L6-3.0 / 12-15 335i (F30) L6 3.0L,$140.00 ,$150.00 ,31-Dec-69,31-Dec-69,-,$0.00 ,E
,aFe Power,54-82212,Air Filter,BMW 2/3/4-Series 12-18 L4-2.0L (t) N20,N20 2.0T,aFe MagnumFORCE Intake Stage-2 Si Pro 5R BMW 328i (F30) 2012-15 L4 2.0L Turbo N20,$140.00 ,$150.00 ,31-Dec-69,31-Dec-69,-,$0.00 ,E
,aFe Power,56-10004R,Air Filter,Infiniti Q50 +16,3.0TT,aFe Takeda Stage-2 Pro 5R Cold Air Intake System 16-19 Infinity Q50/Q60 V6-3.0L (tt),$140.00 ,$150.00 ,31-Dec-69,31-Dec-69,-,$0.00 ,E
,aFe Power,56-10005R,Air Filter,Kia Forte GT +18,1.6T,aFe Takeda Stage-2 AIS P5R 17-19 Hyundai Elantra Sport L4-1.6L (t),$140.00 ,$150.00 ,31-Dec-69,31-Dec-69,-,$0.00 ,E
,aFe Power,56-10009R,Air Filter,Mazda 3 2.5 14-18,2.5L,aFe Takeda Stage-2 Cold Air Intake System w/Pro 5R Filter 14-18 Mazda 3 I4-2.0L,$140.00 ,$150.00 ,31-Dec-69,31-Dec-69,-,$0.00 ,E
,aFe Power,56-10020R,Air Filter,Mazda 3 2.0 14-18,2.0L,aFe Takeda Stage-2 Cold Air Intake System Pro 5R 14-18 Mazda 3 L4-2.0 - Black,$140.00 ,$150.00 ,31-Dec-69,31-Dec-69,-,$0.00 ,E
,aFe Power,56-70001R,Air Filter,Honda Fit L4 1.5 15-18,1.5L,aFe Takeda Momentum Pro 5R Cold Air Intake System 15-18 Honda Fit I4-1.5L,$140.00 ,$150.00 ,31-Dec-69,31-Dec-69,-,$0.00 ,E
,aFe Power,56-70044R,Air Filter,Mazda 3 2.2L L4 19-21,2.5L,aFe Takeda Momentum Cold Air Intake System w/ Pro 5R Filter Mazda 3 19-21 L4-2.5L,$140.00 ,$150.00 ,31-Dec-69,31-Dec-69,-,$0.00 ,E
,aFe Power,56-70048R,Air Filter,Ford Fiesta 1.6 14-21,1.6L,aFe Takeda Momentum Pro 5R Cold Air Intake System 14-19 Ford Fiesta L4-1.6L,$140.00 ,$150.00 ,31-Dec-69,31-Dec-69,-,$0.00 ,E
,aFe Power,57-10005D,Air Filter,Track Series Carbon Fiber Pro Dry S AIS - 16-19 Chevrolet Camaro SS V8-6.2L,6.2L,aFe Track Series Carbon Fiber Pro Dry S AIS - 16-19 Chevrolet Camaro SS V8-6.2L,$140.00 ,$150.00 ,31-Dec-69,31-Dec-69,-,$0.00 ,E
,aFe Power,58-10001R,Air Filter,12-19 Jeep Gand Cherokee (WK2) SRT-8/SRT V8 6.4L HEMI,6.4L,aFe Black Series Cold Air Intake 12-19 Jeep Gand Cherokee (WK2) SRT-8/SRT V8 6.4L HEMI,$140.00 ,$150.00 ,31-Dec-69,31-Dec-69,-,$0.00 ,E
,aFe Power,TA-3007B,Air Filter,Nissan GT-R +09,3.8TT,aFe Takeda Air Intake System Stage-2 PRO 5R 09-14 Nissan GT-R V6 3.8L (tt) - Black,$140.00 ,$150.00 ,31-Dec-69,31-Dec-69,-,$0.00 ,E
,aFe Power,TA-3016S,Air Filter,Nissan Infiniti 3.7,3.7L,aFe Takeda Intakes Stage-2 PDS AIS PDS Splash Shield: TA-3016P,$140.00 ,$150.00 ,31-Dec-69,31-Dec-69,-,$0.00 ,E
,aFe Power,TM-1025B-R,Air Filter,Honda Civic Type R L4 2.0T +17,2.0T,aFe Momentum GT Pro 5R Cold Air Intake System 2017 Honda Civic Type R L4-2.0L (t),$140.00 ,$150.00 ,31-Dec-69,31-Dec-69,-,$0.00 ,E
,aFe Power,TR-1007B,Air Filter,Honda Accord/Acura TL 08-11 V6-3.5L/3.7L,3.5L/3.7L,aFe Takeda Intakes Stage-2 PDS AIS PDS Honda Accord 08-11 / Acura TL 09-11 V6-3.5/L3.7L (blk),$140.00 ,$150.00 ,31-Dec-69,31-Dec-69,-,$0.00 ,E
,aFe Power,TR-5306B-R,Air Filter,Ford Focus ST 4L 2.0T 15-17,2.0T,aFe Takeda Stage-2 Pro 5R Cold Air Intake System 15-17 Ford Focus St L4-2.0L (t) EcoBoost,$140.00 ,$150.00 ,31-Dec-69,31-Dec-69,-,$0.00 ,E
,Airaid,250-332,Air Filter,Chevrolet Camaro 16,3.7L,Airaid 2016 Chevrolet Camaro V6-3.6L F/I Intake System w/ Tube (Oiled / Red Media),$140.00 ,$150.00 ,31-Dec-69,31-Dec-69,-,$0.00 ,E
,Airaid,860-399,Air Filter,"Ford Mustang GT500 5.4SC 14, GT350 V8 5.2 16-20",5.4SC/5.2L,Airaid 10-14 Ford Mustang Shelby 5.4L Supercharged Direct Replacement Filter - Oiled / Red Media,$140.00 ,$150.00 ,31-Dec-69,31-Dec-69,-,$0.00 ,E
,Alta,AMPSUS100,Suspension,Mini R56/R57/R58/R59/R60 07-14,1.6T,Alta 02-06 Mini & 07+ R56 Mini V2 Rear Adjustable Control Arms (Set of 2),$140.00 ,$150.00 ,31-Dec-69,31-Dec-69,-,$0.00 ,E
,AMS,ALP.19.02.0001-1,Cooling,Mercedes Benz A45 AMG 14-18,2.0T,AMS Performance 14-18 Mercedes-Benz CLA 45 AMG 2.0T Alpha Auxiliary Heat Exchanger Upgrade,$140.00 ,$150.00 ,31-Dec-69,31-Dec-69,-,$0.00 ,E
,AMS,ALP.19.09.0001-2,Cooling,Mercedes Benz A45 AMG 14-18,2.0T,AMS Performance Mercedes-Benz M133 AMG Alpha Intercooler,$140.00 ,$150.00 ,31-Dec-69,31-Dec-69,-,$0.00 ,E
,AMS,AMS.21.08.0001-1,Air Filter,Audi / Seat / Volkswagen GTI 2.0T,2.0T,AMS Performance 2015+ VW Golf R MK7 Carbon Fiber Intake,$140.00 ,$150.00 ,31-Dec-69,31-Dec-69,-,$0.00 ,E
,AMS,AMS.21.08.0001-2,Air Filter,Audi / Seat / Volkswagen GTI MK7 2.0T,2.0T,AMS Performance 2015+ VW Golf R MK7 Chopped Carbon Fiber Intake,$140.00 ,$150.00 ,31-Dec-69,31-Dec-69,-,$0.00 ,E
,APR,AS-105918,Exterior,Subaru WRX/STi 08-14 Sedan,2.5T,APR Performance Carbon Fiber GTC-200 STI Spec Adjustable Wing Subaru STI 2011-2014,$140.00 ,$150.00 ,31-Dec-69,31-Dec-69,-,$0.00 ,E
,APR,CI100038,Turbo/SC,Audi TTRS 8S 2.5T,2.5T,"APR 4"" 2.5TFSI EVO Turbocharger Inlet System",$140.00 ,$150.00 ,31-Dec-69,31-Dec-69,-,$0.00 ,E
,APR,CI100038-A,Air Filter,Audi TTRS 8S 2.5T,2.5T,APR 2.5 TFSI EVO Intake Filter System,$140.00 ,$150.00 ,31-Dec-69,31-Dec-69,-,$0.00 ,E
,APR,CI100040,Air Filter,Audi/Cupra/Seat/Volkswagen 2.0T,2.0T,APR Open Carbon Intake System Audi | Volkswagen 1.8L | 2.0L L4 2015-2022,$140.00 ,$150.00 ,31-Dec-69,31-Dec-69,-,$0.00 ,E
,ARB,2613,Suspension,Toyota Tundra V8 5.7 +08,5.7L,ARB / OME Coil Spring Front Tundra 07On B&W,$140.00 ,$150.00 ,31-Dec-69,31-Dec-69,-,$0.00 ,E
,ARB,2885,Suspension,Toyota Land Cruiser Prado,3.0L/4.0L,ARB / OME Coil Spring Front Prado 4/03 On,$140.00 ,$150.00 ,31-Dec-69,31-Dec-69,-,$0.00 ,E
,ARB,2886,Suspension,Toyota Tacoma V6 3.5 2016+,3.5L,ARB / OME Coil Spring Front Tacoma 06On Hd,$140.00 ,$150.00 ,31-Dec-69,31-Dec-69,-,$0.00 ,E
,ARB,2896,Suspension,Toyota 4Runner 03-09,4.0L,ARB / OME Coil Spring Rear Prado 4/2003,$140.00 ,$150.00 ,31-Dec-69,31-Dec-69,-,$0.00 ,E
,ARB,2914,Suspension,Mitsubishi Montero Limtied V6 3.8L,3.8L,ARB / OME Coil Spring Front Mits Pajero Nm,$140.00 ,$150.00 ,31-Dec-69,31-Dec-69,-,$0.00 ,E
,ARB,2998,Suspension,Ford Ranger 3.2TDI,3.2TDI,ARB / OME Coil Spring Front Bt50/Ranger 2011On,$140.00 ,$150.00 ,31-Dec-69,31-Dec-69,-,$0.00 ,E
,ARB,2999,Suspension,Ford Ranger 3.2TD,3.2TD,ARB / OME Coil Spring Front Bt50/Ranger 2011On,$140.00 ,$150.00 ,31-Dec-69,31-Dec-69,-,$0.00 ,E
,ARB,3103,Suspension,Mitsubishi L200 +15,2.4TDI,ARB / OME Coil Spring Front Triton,$140.00 ,$150.00 ,31-Dec-69,31-Dec-69,-,$0.00 ,E
,ARB,3104,Suspension,Mitsubishi L200 2.4TDI +16,2.4TDI,ARB / OME Coil Spring Front Triton,$140.00 ,$150.00 ,31-Dec-69,31-Dec-69,-,$0.00 ,E
,ARB,3110,Suspension,Mitsubishi Montero Limtied V6 3.8L,3.8L,ARB / OME Coil Spring Rear Mits Pajeromed,$140.00 ,$150.00 ,31-Dec-69,31-Dec-69,-,$0.00 ,E
,ARB,60004,Suspension,Toyota Land Cruiser Prado,3.0L/4.0L,ARB / OME Nitrocharger Sport Shock Prado 120 -R-,$140.00 ,$150.00 ,31-Dec-69,31-Dec-69,-,$0.00 ,E
,ARB,60005,Suspension,Toyota Land Cruiser Prado,3.0L/4.0L,ARB / OME Nitrocharger Sport Shock Prado 120 -R-,$140.00 ,$150.00 ,31-Dec-69,31-Dec-69,-,$0.00 ,E
,ARB,60019,Suspension,Mitsubishi Montero Limtied V6 3.8L,3.8L,ARB / OME Nitrocharger Sport Shock Mitsubishi Pajero R,$140.00 ,$150.00 ,31-Dec-69,31-Dec-69,-,$0.00 ,E
,ARB,60066,Suspension,Jeep Wrangler JK 4 Door,All,ARB / OME Nitrocharger Sport Shock Jeep Wrangler Jk F,$140.00 ,$150.00 ,31-Dec-69,31-Dec-69,-,$0.00 ,E
,ARB,60067,Suspension,Jeep Wrangler JK 4 Door,All,ARB / OME Nitrocharger Sport Shock Jeep Wrangler Jk R,$140.00 ,$150.00 ,31-Dec-69,31-Dec-69,-,$0.00 ,E
,ARB,60091,Suspension,Toyota Tacoma V6 3.5 2016+,3.5L,ARB / OME Nitrocharger Sport Shock Tacoma 2005 On -R,$140.00 ,$150.00 ,31-Dec-69,31-Dec-69,-,$0.00 ,E
,ARB,60101,Suspension,Ford Ranger 3.2TDI,3.2TDI,ARB / OME Nitrocharger Sport Shock Bt50/Ranger R 2011 On,$140.00 ,$150.00 ,31-Dec-69,31-Dec-69,-,$0.00 ,E
,ARB,60112,Suspension,FJ Cruiser,4.0L,ARB / OME Nitrocharger Sport Shock Prado 120 -R,$140.00 ,$150.00 ,31-Dec-69,31-Dec-69,-,$0.00 ,E
,ARB,60138,Suspension,Mitsubishi L200 +15,2.4TDI,ARB / OME Nitrocharger Sport Shock Triton 2015On,$140.00 ,$150.00 ,31-Dec-69,31-Dec-69,-,$0.00 ,E
,ARB,60139,Suspension,Mitsubishi L200 2.4TDI +15,2.4TDI,ARB / OME Nitrocharger Sport Shock Triton 2015On,$140.00 ,$150.00 ,31-Dec-69,31-Dec-69,-,$0.00 ,E
,ARB,90000,Suspension,Toyota Land Cruiser Prado,3.0L/4.0L,ARB / OME Nitrocharger Sport Strut Toyota Front,$140.00 ,$150.00 ,31-Dec-69,31-Dec-69,-,$0.00 ,E
,ARB,90006,Suspension,Mitsubishi Montero Limtied V6 3.8L,3.8L,ARB / OME Nitrocharger Sport Strut Mits Pajero Ns/Np,$140.00 ,$150.00 ,31-Dec-69,31-Dec-69,-,$0.00 ,E
,ARB,90018,Suspension,Toyota Tundra V8 5.7 +07,5.7L,ARB / OME Nitrocharger Sport Strut Tundra 07 On,$140.00 ,$150.00 ,31-Dec-69,31-Dec-69,-,$0.00 ,E
,ARB,90019,Suspension,Ford Ranger 3.2TDI,3.2TDI,ARB / OME Nitrocharger Sport Strut Bt50/Ranger F 2011 On,$140.00 ,$150.00 ,31-Dec-69,31-Dec-69,-,$0.00 ,E
,ARB,90020,Suspension,Ford Ranger 3.2TD,3.2TD,ARB / OME Nitrocharger Sport Strut Bt50/Ranger F 2011 On,$140.00 ,$150.00 ,31-Dec-69,31-Dec-69,-,$0.00 ,E
,ARB,90021,Suspension,FJ Cruiser,4.0L,ARB / OME Nitrocharger Sport Strut Prado 120 -F-,$140.00 ,$150.00 ,31-Dec-69,31-Dec-69,-,$0.00 ,E
,ARB,90033,Suspension,Mitsubishi L200 +15,2.4TDI,ARB / OME Nitrocharger Sport Strut Triton 2015On,$140.00 ,$150.00 ,31-Dec-69,31-Dec-69,-,$0.00 ,E
,ARB,3460023,Suspension,Toyota Tacoma V6 3.5 2016+,3.5L,ARB / OME Leaf Spring 30mm Spacer Kit,$140.00 ,$150.00 ,31-Dec-69,31-Dec-69,-,$0.00 ,E
,ARB,EL049R,Suspension,Ford Ranger 3.2TDI,3.2TDI,ARB / OME Leaf Spring D2 Bt50/Ranger 06On R,$140.00 ,$150.00 ,31-Dec-69,31-Dec-69,-,$0.00 ,E
,ARB,FK29,Suspension,Toyota Tacoma V6 3.5 2016+,3.5L,ARB Rear Driveshaft Spacer,$140.00 ,$150.00 ,31-Dec-69,31-Dec-69,-,$0.00 ,E
,ARB,FK57,Suspension,Ford Ranger 3.2TDI,3.2TDI,ARB Driveline Kit Ranger/Bt50,$140.00 ,$150.00 ,31-Dec-69,31-Dec-69,-,$0.00 ,E
,ARB,LCAJKRR,Suspension,Jeep Wrangler 07-18,3.6L,ARB Rear Lower Arm Adj Jeep Jk,$140.00 ,$150.00 ,31-Dec-69,31-Dec-69,-,$0.00 ,E
,ARB,MEU53B,Suspension,Toyota Tacoma V6 3.5 2016+,3.5L,ARB / OME U Bolt Washer & Nut,$140.00 ,$150.00 ,31-Dec-69,31-Dec-69,-,$0.00 ,E
,ARB,OME95PF5,Suspension,Toyota Tacoma V6 3.5 2016+,3.5L,ARB Packer Front Prado,$140.00 ,$150.00 ,31-Dec-69,31-Dec-69,-,$0.00 ,E
,ARB,OMEGS20,Suspension,Ford Ranger 3.2TDI,3.2TDI,ARB Greasable Shackle Kit Rang/Bt50,$140.00 ,$150.00 ,31-Dec-69,31-Dec-69,-,$0.00 ,E
,ARB,OMEJK2DLKS,Suspension,Jeep Wrangler JK 07-18 2 Door,3.6L,ARB Sport Kit Light Jk 2 Door,$140.00 ,$150.00 ,31-Dec-69,31-Dec-69,-,$0.00 ,E
,ARB,OMEJK4DHKS,Suspension,Jeep Wrangle JK 4 Door 08-18,All,ARB Sport Kit Heavy Jk 4 Door,$140.00 ,$150.00 ,31-Dec-69,31-Dec-69,-,$0.00 ,E
,ARB,OMEJK4DLKS,Suspension,Jeep Wrangler JK 07-18 4 Door,3.6L,ARB Sport Kit Light Jk 4 Door,$140.00 ,$150.00 ,31-Dec-69,31-Dec-69,-,$0.00 ,E
,ARB,OMEJL4DBP51HK,Suspension,Jeep Wrangler JL +18,3.6L,ARB 18-20 Jeep JL 4-Door BP51 Heavy Load Kit,$140.00 ,$150.00 ,31-Dec-69,31-Dec-69,-,$0.00 ,E
,ARB,OMEJL4DHKS,Suspension,Jeep Wrangler JL +18,3.6L,ARB Jeep JL 4 Door OME Heavy Kit,$140.00 ,$150.00 ,31-Dec-69,31-Dec-69,-,$0.00 ,E
,ARB,OMESB118,Suspension,Ford Ranger 3.2TDI,3.2TDI,ARB / OME G Shackle Bushing Kit 19-20 Ford Ranger,$140.00 ,$150.00 ,31-Dec-69,31-Dec-69,-,$0.00 ,E
,ARB,OMESD48,Suspension,Jeep Wrangler JK 4 Door,All,ARB / OME Steering Damper Jeep-W/Dust Boot,$140.00 ,$150.00 ,31-Dec-69,31-Dec-69,-,$0.00 ,E
,ARB,OMETJLKS,Suspension,Jeep Wrangler Sahara 02,4.0L,ARB Sport Kit Light Tj Hvy Kit 97-06,$140.00 ,$150.00 ,31-Dec-69,31-Dec-69,-,$0.00 ,E
,ARB,OMEU66,Suspension,Ford Ranger 3.2TDI,3.2TDI,ARB / OME U Bolt Washer & Nut,$140.00 ,$150.00 ,31-Dec-69,31-Dec-69,-,$0.00 ,E
,ARB,RD219,Off-road,Ford Ranger PXII 3.2TDi,3.2TD,ARB Airlocker 29 Spl Fr T6 Ranger/Bt50 S/N,$140.00 ,$150.00 ,31-Dec-69,31-Dec-69,-,$0.00 ,E
,ARB,TACBP51HP,Suspension,Toyota Tacoma V6 3.5 2016+,3.5L,ARB / OME 05-20 Toyota Tacoma Heavy Load BP-51 Lift Kit,$140.00 ,$150.00 ,31-Dec-69,31-Dec-69,-,$0.00 ,E
,ARB,UCA0004,Suspension,Toyota 4Runner / FJ Cruiser V6,4.0L,ARB OME Front UCA for 2003+ Toyota 4-Runner (Pair),$140.00 ,$150.00 ,31-Dec-69,31-Dec-69,-,$0.00 ,E
,ARB,UCA0005,Suspension,Toyota Tacoma V6 3.5 +05,3.5L,ARB OME Front UCA for 2005+ Toyota Tacoma (Pair),$140.00 ,$150.00 ,31-Dec-69,31-Dec-69,-,$0.00 ,E
,ARB,UCAJKRR,Suspension,Jeep Wrangler 07-18,3.6L,ARB Rear Uca Adj Jeep Jk,$140.00 ,$150.00 ,31-Dec-69,31-Dec-69,-,$0.00 ,E
,ARP,154-4301,Engine,Ford F-150 V8 5.8L 88-99,5.8L,ARP SB Ford WP Standard Iron Block/Aluminum Head Stud Kit,$140.00 ,$150.00 ,31-Dec-69,31-Dec-69,-,$0.00 ,E
,ARP,156-5803,Engine,Ford Mustang +13,5.0L,ARP Ford 5.0L Coyote Main Stud Kit,$140.00 ,$150.00 ,31-Dec-69,31-Dec-69,-,$0.00 ,E
,ARP,208-4701,Engine,Honda K-Series,K20 2.0L/K24 2.4L,ARP Honda/Acura K20A (A2 & A3) Head Stud Kit,$140.00 ,$150.00 ,31-Dec-69,31-Dec-69,-,$0.00 ,E
,ARP,208-6003,Engine,Honda K-Series,K20 2.0L/K24 2.4L,ARP Honda/Acura K20A Rod Bolt Kit,$140.00 ,$150.00 ,31-Dec-69,31-Dec-69,-,$0.00 ,E
